{
  "$schema": "https://json-schema.org/draft/2020-12/schema",
  "$id": "https://letzscan.lu/schemas/release.schema.json",
  "type": "object",
  "properties": {
    "id": {
      "type": "string",
      "minLength": 1,
      "maxLength": 128,
      "pattern": "^[a-z0-9][a-z0-9._:-]*$"
    },
    "created_at": {
      "type": "string",
      "format": "date-time",
      "pattern": "^(?:(?:\\d\\d[2468][048]|\\d\\d[13579][26]|\\d\\d0[48]|[02468][048]00|[13579][26]00)-02-29|\\d{4}-(?:(?:0[13578]|1[02])-(?:0[1-9]|[12]\\d|3[01])|(?:0[469]|11)-(?:0[1-9]|[12]\\d|30)|(?:02)-(?:0[1-9]|1\\d|2[0-8])))T(?:(?:[01]\\d|2[0-3]):[0-5]\\d(?::[0-5]\\d(?:\\.\\d+)?)?(?:Z|([+-](?:[01]\\d|2[0-3]):[0-5]\\d)))$"
    },
    "pipeline_version": {
      "type": "string",
      "minLength": 1
    },
    "status": {
      "type": "string",
      "enum": [
        "draft",
        "published",
        "failed"
      ]
    },
    "inputs": {
      "default": [],
      "type": "array",
      "items": {
        "type": "object",
        "properties": {
          "source_id": {
            "type": "string",
            "minLength": 1,
            "maxLength": 128,
            "pattern": "^[a-z0-9][a-z0-9._:-]*$"
          },
          "dataset_id": {
            "type": "string",
            "minLength": 1,
            "maxLength": 128,
            "pattern": "^[a-z0-9][a-z0-9._:-]*$"
          },
          "url": {
            "type": "string",
            "format": "uri"
          },
          "fetched_at": {
            "type": "string",
            "format": "date-time",
            "pattern": "^(?:(?:\\d\\d[2468][048]|\\d\\d[13579][26]|\\d\\d0[48]|[02468][048]00|[13579][26]00)-02-29|\\d{4}-(?:(?:0[13578]|1[02])-(?:0[1-9]|[12]\\d|3[01])|(?:0[469]|11)-(?:0[1-9]|[12]\\d|30)|(?:02)-(?:0[1-9]|1\\d|2[0-8])))T(?:(?:[01]\\d|2[0-3]):[0-5]\\d(?::[0-5]\\d(?:\\.\\d+)?)?(?:Z|([+-](?:[01]\\d|2[0-3]):[0-5]\\d)))$"
          },
          "sha256": {
            "type": "string",
            "pattern": "^[0-9a-f]{64}$"
          },
          "bytes": {
            "type": "integer",
            "minimum": 0,
            "maximum": 9007199254740991
          }
        },
        "required": [
          "source_id",
          "fetched_at",
          "sha256"
        ]
      }
    },
    "outputs": {
      "default": [],
      "type": "array",
      "items": {
        "type": "object",
        "properties": {
          "path": {
            "type": "string",
            "minLength": 1
          },
          "sha256": {
            "type": "string",
            "pattern": "^[0-9a-f]{64}$"
          },
          "bytes": {
            "type": "integer",
            "minimum": 0,
            "maximum": 9007199254740991
          },
          "content_type": {
            "type": "string"
          }
        },
        "required": [
          "path",
          "sha256",
          "bytes"
        ]
      }
    },
    "warnings": {
      "default": [],
      "type": "array",
      "items": {
        "type": "string"
      }
    }
  },
  "required": [
    "id",
    "created_at",
    "pipeline_version",
    "status"
  ],
  "title": "Release",
  "description": "An immutable publication unit with its input and output checksums."
}
