{
  "created_at": "2026-08-19T15:49:23.498050Z",
  "id": "statec-lustat-20260819-154923",
  "inputs": [
    {
      "fetched_at": "2026-08-19T15:49:23.406220Z",
      "sha256": "7964eb2d311adee2884fd24b8a412739cb3727dbeeebf1c2f9debdfb83d07e81",
      "source_id": "statec-lustat"
    }
  ],
  "outputs": [
    {
      "bytes": 2545,
      "content_type": "application/json",
      "path": "catalog/datasets/statec-lustat.population-by-commune.json",
      "sha256": "a31efe54bf19e5e783cb108adf3b15e7c04462573dbe3a13c58dfeb8d6eb1601"
    },
    {
      "bytes": 3003,
      "content_type": "application/json",
      "path": "catalog/sources/statec-lustat.json",
      "sha256": "154be4d56f4526362c7974bfcd7a3952fd17a2a585994181f97bff1a55cc8259"
    },
    {
      "bytes": 20096,
      "content_type": "application/json",
      "path": "catalog/geographies/lu-communes.json",
      "sha256": "d11f67d8d88985be2f6e34bd27b1e2dfc70b91427a1170f1a652e15864fad673"
    },
    {
      "bytes": 538,
      "content_type": "application/json",
      "path": "catalog/indicators/population.total.json",
      "sha256": "bcfdf24e4480c65401756237eecc461a73d33145b4e52a9af3caf7b526ab2a8c"
    },
    {
      "bytes": 948,
      "content_type": "application/json",
      "path": "places/lu.commune.0204.json",
      "sha256": "1fb8027d747e5a9bfa95c477c12a5003307560a76b8713398fc820e6695c9b7b"
    },
    {
      "bytes": 945,
      "content_type": "application/json",
      "path": "places/lu.commune.0308.json",
      "sha256": "b6579be522c27e1ede1de54fc40ced4344f875183c75594292d30fac7c97c3d8"
    },
    {
      "bytes": 945,
      "content_type": "application/json",
      "path": "places/lu.commune.0404.json",
      "sha256": "975a6e48b2344e3c46b82306b15995c4e49386bac09c1666659977f5ad281369"
    },
    {
      "bytes": 945,
      "content_type": "application/json",
      "path": "places/lu.commune.0504.json",
      "sha256": "0eb776aaff2ad677b307bc3fe5a7b061b56f706b2f1d0e00cc10a8f2ae66a563"
    },
    {
      "bytes": 945,
      "content_type": "application/json",
      "path": "places/lu.commune.0704.json",
      "sha256": "b50df746eaa7a916a56eb7006075e61eea91c6b8702ee62f440ea46b6913fe97"
    },
    {
      "bytes": 945,
      "content_type": "application/json",
      "path": "places/lu.commune.1204.json",
      "sha256": "c3299ee8ca83f60f3524e9ee0c5e4adb536f4b74f3552e2bcc96b3d69cce2b61"
    },
    {
      "bytes": 945,
      "content_type": "application/json",
      "path": "places/lu.commune.1001.json",
      "sha256": "78fb0014e6376d94f51dd17c3410544a1dea337dd4994dd171acccbc1056c4f8"
    },
    {
      "bytes": 945,
      "content_type": "application/json",
      "path": "places/lu.commune.0505.json",
      "sha256": "17da645f986cf5448df9cf7aaa5ba492592573987def41fde398fefb09bfd123"
    },
    {
      "bytes": 945,
      "content_type": "application/json",
      "path": "places/lu.commune.0702.json",
      "sha256": "6f4bfd32dfb109dc0b28839516573b9dab0b5909a72e96144a125bfd40136974"
    },
    {
      "bytes": 945,
      "content_type": "application/json",
      "path": "places/lu.commune.1101.json",
      "sha256": "d5a8bbf99514456096b8081f9e0b5a292bef2b6ca10efb6411bc6da2760bd220"
    },
    {
      "bytes": 945,
      "content_type": "application/json",
      "path": "places/lu.commune.1206.json",
      "sha256": "cbc0ff1e9fc77e0bacf8fc03c4980f877f7a1e27d22e478236aa8ef855ae9685"
    },
    {
      "bytes": 945,
      "content_type": "application/json",
      "path": "places/lu.commune.0807.json",
      "sha256": "5726fb54a750439c9c4fe09ab7c048326a9fe907ecbdc9267c05603aa8370cfd"
    },
    {
      "bytes": 945,
      "content_type": "application/json",
      "path": "places/lu.commune.0901.json",
      "sha256": "b2fbcfe09132b45971f55ac8e0c3ac1df622fcf5751de11777f79d5e23acd67d"
    },
    {
      "bytes": 945,
      "content_type": "application/json",
      "path": "places/lu.commune.0101.json",
      "sha256": "b57ae4cda3a84a77104b37f70306a62d6cc5a579ef5c6ebe8e321fba36db52c2"
    },
    {
      "bytes": 945,
      "content_type": "application/json",
      "path": "places/lu.commune.0311.json",
      "sha256": "d3e6a5550e176aff5261fa8c31eec9e4c1abd03a0bfef0f931bec860b941ad6a"
    },
    {
      "bytes": 945,
      "content_type": "application/json",
      "path": "places/lu.commune.0610.json",
      "sha256": "b45524989c26bbb549f32d61e1d041d2f4e939acf92221e9a2d0a67fdb62f227"
    },
    {
      "bytes": 945,
      "content_type": "application/json",
      "path": "places/lu.commune.1006.json",
      "sha256": "fef6ddc9cebbc3067bdd652f555d4cac20d4fd4a3034c547bf2c98dd9403ac10"
    },
    {
      "bytes": 945,
      "content_type": "application/json",
      "path": "places/lu.commune.1108.json",
      "sha256": "bffc87a166a8a1ff2f1b4c2f27885c1fc8b50a0ba660c6008c3a1f16e6fc99c0"
    },
    {
      "bytes": 945,
      "content_type": "application/json",
      "path": "places/lu.commune.0302.json",
      "sha256": "0e90e1c8fb5247cc98bc804c9a9a01be8e12930616e35d8cb832f1f1718c593d"
    },
    {
      "bytes": 945,
      "content_type": "application/json",
      "path": "places/lu.commune.0305.json",
      "sha256": "ff76a29526fb564283134f8a56b916fbe84e1ca0b511f2eec20ceb188bcdea64"
    },
    {
      "bytes": 945,
      "content_type": "application/json",
      "path": "places/lu.commune.0401.json",
      "sha256": "333d95c0a7cab1b73af9cec1a25e943e43ce1cf757e991a4027f0c830b7c11ed"
    },
    {
      "bytes": 945,
      "content_type": "application/json",
      "path": "places/lu.commune.1002.json",
      "sha256": "84f0809534309c13270b087735fe794a0f4fd21f598ef6865e915d2d42394ae9"
    },
    {
      "bytes": 945,
      "content_type": "application/json",
      "path": "places/lu.commune.1103.json",
      "sha256": "a3cd8fdea592dd30f0358c1794b192b620f6486e5db93eda7c0ec90501c6b574"
    },
    {
      "bytes": 945,
      "content_type": "application/json",
      "path": "places/lu.commune.0105.json",
      "sha256": "e89c11d50d22ca9f58555184aacb727343dabe335083e4a18c7e4f394a38a3b7"
    },
    {
      "bytes": 945,
      "content_type": "application/json",
      "path": "places/lu.commune.0212.json",
      "sha256": "9b1d1952d7e62ac4069e37a57236c0f55830ab613c170441c5fab0c8ee4ec723"
    },
    {
      "bytes": 945,
      "content_type": "application/json",
      "path": "places/lu.commune.0307.json",
      "sha256": "6734f2bcc94409ce1d06867a19cb3d6b1501f808f6b55d5b5838951c2f55e56f"
    },
    {
      "bytes": 945,
      "content_type": "application/json",
      "path": "places/lu.commune.0607.json",
      "sha256": "ce1f59325c31ce3b0e9f21198916cc309ec845dc8bccad428821e69ac62d6a2d"
    },
    {
      "bytes": 945,
      "content_type": "application/json",
      "path": "places/lu.commune.0403.json",
      "sha256": "ddfbaf345a713e17e1a9eb7e1b7557636c32b34af138fa44175b102a765245bd"
    },
    {
      "bytes": 945,
      "content_type": "application/json",
      "path": "places/lu.commune.0804.json",
      "sha256": "a7f89587475d2ecb13785506d285f59373b2c1a50cfee7e20806a23999177c89"
    },
    {
      "bytes": 945,
      "content_type": "application/json",
      "path": "places/lu.commune.1205.json",
      "sha256": "c64f44519d81f2128a86802b34da82c44b9a95ee1bcbb2361f024dd40e7051a1"
    },
    {
      "bytes": 945,
      "content_type": "application/json",
      "path": "places/lu.commune.0801.json",
      "sha256": "b97c9fd72a76a0a4da6934f6395359d9dab3352f7535383ebf05bf7a510cc0a4"
    },
    {
      "bytes": 945,
      "content_type": "application/json",
      "path": "places/lu.commune.0502.json",
      "sha256": "bebbd175993f24c96fccb6149c00381136c3c227cc998f645852766a1c39ec62"
    },
    {
      "bytes": 945,
      "content_type": "application/json",
      "path": "places/lu.commune.0102.json",
      "sha256": "6a4d6ad368ac5ffaace59eb18554dac0bfb654d4d447475f48e2299d57ee72bd"
    },
    {
      "bytes": 945,
      "content_type": "application/json",
      "path": "places/lu.commune.0301.json",
      "sha256": "b3dc8f5eb7416c926ef99734226b7d7b82910ca02a120df7d12c0c4ef93358f7"
    },
    {
      "bytes": 945,
      "content_type": "application/json",
      "path": "places/lu.commune.0407.json",
      "sha256": "fa3089b24f20e10cabc5d34dc589f2b528fa1bf0e1b6a0a871401541cbb785a9"
    },
    {
      "bytes": 945,
      "content_type": "application/json",
      "path": "places/lu.commune.1104.json",
      "sha256": "315eb76f674df5347aeeb6292b0019695fda39bffc02858fe93e2285c0e60f4f"
    },
    {
      "bytes": 945,
      "content_type": "application/json",
      "path": "places/lu.commune.0110.json",
      "sha256": "99ed40c5fe28b856ec8f23c0cb3b76958c6fa2b3e3bab5823de69c184a17a0db"
    },
    {
      "bytes": 948,
      "content_type": "application/json",
      "path": "places/lu.commune.0201.json",
      "sha256": "8ef0fb805f163378ce2804fad331dfe002fba5ef0ab27ba8dc7d07864ff0433d"
    },
    {
      "bytes": 945,
      "content_type": "application/json",
      "path": "places/lu.commune.0207.json",
      "sha256": "a944e7f1fc8d39a6dcfc6135f0ddd52ce89e822d90e077989ddd1e9573040727"
    },
    {
      "bytes": 945,
      "content_type": "application/json",
      "path": "places/lu.commune.0208.json",
      "sha256": "9d8f6da0dbdb5ccf8e50ac85713f7fdc11c1c9d88809e7880fd4d4c254ba98e3"
    },
    {
      "bytes": 948,
      "content_type": "application/json",
      "path": "places/lu.commune.0209.json",
      "sha256": "4466d29591d7bde4aac8d3a69661dba991598f55653590ac91cb0eb9b0846360"
    },
    {
      "bytes": 948,
      "content_type": "application/json",
      "path": "places/lu.commune.0409.json",
      "sha256": "6737cc5d61980007f7b8ee61c0ad337a5ea03d1a38d91847953bda66162e60bf"
    },